{
  "name": {
    "zh": "瓛瓛",
    "en": "Stellan Huan"
  },
  "title": "瓛瓛 HuanHuan — Photography",
  "domain": "stellanhuan.github.io",
  "language": "zh",
  "languages": [
    "zh",
    "ja",
    "en"
  ],
  "social": {
    "wechat": "S0688888860",
    "github": "StellanHuan"
  },
  "sections": {
    "hero": [
      "web_055.jpeg"
    ],
    "featured": [
      "web_003.jpeg",
      "web_124.jpeg",
      "web_046.jpeg",
      "web_011.jpeg"
    ],
    "hscroll": [
      "web_007.jpeg",
      "web_009.jpeg",
      "web_026.jpeg"
    ],
    "landscape": [
      "web_005.jpeg",
      "web_041.jpeg",
      "web_045.jpeg",
      "web_017.jpeg"
    ],
    "aerial": [
      "web_027.jpeg",
      "web_022.jpeg",
      "web_044.jpeg",
      "web_021.jpeg",
      "web_082.jpeg"
    ],
    "about": [
      "web_147.jpeg",
      "web_139.jpeg",
      "web_108.jpeg"
    ],
    "booking_portrait": [
      "web_133.jpeg",
      "web_103.jpeg",
      "web_128.jpeg",
      "web_110.jpeg"
    ],
    "booking_event": [
      "web_040.jpeg"
    ],
    "booking_aerial": [
      "web_004.jpeg",
      "web_010.jpeg"
    ]
  },
  "booking": {
    "portrait": {
      "price": 398,
      "currency": "CNY"
    },
    "event": {
      "price": 1500,
      "unit": "half-day"
    },
    "aerial": {
      "price": 500,
      "addon": true
    }
  },
  "copyright": "© 2026 瓛瓛 HuanHuan"
}